semSort,id,card,level,businessTerm,desc,dataType,businessTerm_ja,desc_ja,synSort,element,synDatatype,xPath,occur
1000,ibg-00,1..1,0,Invoice,Commercial invoice,,デジタルインボイス,請求書,1000,ubl:Invoice,InvoiceType,/Invoice,1..1
1010,ibt-001,1..1,1,Invoice number,A unique identification of the Invoice.,Identifier,請求書番号,請求書の一意識別番号。,1030,cbc:ID,udt:IdentifierType,/Invoice/cbc:ID,1..1
1020,ibt-002,1..1,1,Invoice issue date,The date when the Invoice was issued.,Date,請求書発行日,請求書の発行日付。,1040,cbc:IssueDate,udt:DateType,/Invoice/cbc:IssueDate,1..1
1030,ibt-168,0..1,1,Invoice issue time,The time of day when an invoice was issued,Time,請求書発行時刻,請求書の発行時刻。,1050,cbc:IssueTime,udt:TimeType,/Invoice/cbc:IssueTime,0..1
1040,ibt-003,1..1,1,Invoice type code,A code specifying the functional type of the Invoice.,Code,請求書タイプコード,この文書のタイプを識別するコード。請求書の機能を特定するためのコード。,1070,cbc:InvoiceTypeCode,udt:CodeType,/Invoice/cbc:InvoiceTypeCode,0..1
1050,ibt-005,1..1,1,Invoice currency code,"The currency in which all Invoice amounts are given	 except for the Total TAX amount in accounting currency.",Code,請求書通貨コード,請求書に記載された通貨を表すコード。会計通貨での請求書消費税合計金額を除き、請求書に記載されている全て金額の表示の通貨コード。,1100,cbc:DocumentCurrencyCode,udt:CodeType,/Invoice/cbc:DocumentCurrencyCode,0..1
1060,ibt-006,0..1,1,Tax accounting currency,The currency used for TAX accounting and reporting purposes as accepted or required in the country of the Seller.,Code,税会計報告用通貨コード,会計報告や税務報告に使用する通貨を表すコード。売り手の国で認められたもしくは要求された会計報告や税務報告に使用する通貨を表すコード。,1110,cbc:TaxCurrencyCode,udt:CodeType,/Invoice/cbc:TaxCurrencyCode,0..1
1070,ibt-007,0..1,1,TAX point date,"The date when the TAX becomes accountable for the Seller and for the Buyer in so far as that date can be determined and differs from the date of issue of the invoice	 according to the TAX directive.",Date,課税基準日,,1090,cbc:TaxPointDate,udt:DateType,/Invoice/cbc:TaxPointDate,0..1
1080,ibt-008,0..1,1,TAX point date code,The code of the date when the TAX becomes accountable for the Seller and for the Buyer.,Code,課税基準日コード,売り手、買い手が税を記帳する日付が何であるかを示すコード。,1170,cbc:DescriptionCode,udt:CodeType,/Invoice/cac:InvoicePeriod/cbc:DescriptionCode,0..n
1090,ibt-009,0..1,1,Payment due date,The date when the payment is due.,Date,支払期日,支払条件で示された支払期日。,1060,cbc:DueDate,udt:DateType,/Invoice/cbc:DueDate,0..1
1100,ibt-010,0..1,1,Buyer reference,An identifier assigned by the Buyer used for internal routing purposes.,Text,買い手参照,買い手によって割り当てられたIDで、買い手の請求書精算業務の処理ワークフローで使用する。,1130,cbc:BuyerReference,udt:TextType,/Invoice/cbc:BuyerReference,0..1
1110,ibt-011,0..1,1,Project reference,The identification of the project the invoice refers to,Document Reference,プロジェクト参照,発注品に関するプロジェクト・工事案件等を管理するための番号。,1460,cbc:ID,udt:IdentifierType,/Invoice/cac:ProjectReference/cbc:ID,1..1
1120,ibt-012,0..1,1,Contract reference,The identification of a contract.,Document Reference,契約書参照,参照する契約書に記載された文書番号。,1320,cbc:ID,udt:IdentifierType,/Invoice/cac:ContractDocumentReference/cbc:ID,1..1
1130,ibt-013,0..1,1,Purchase order reference,"An identifier of a referenced purchase order	 issued by the Buyer.",Document Reference,購買発注参照,買い手が発行した購買発注を参照する場合の当該購買発注に記載の文書番号。,1190,cbc:ID,udt:IdentifierType,/Invoice/cac:OrderReference/cbc:ID,1..1
1140,ibt-014,0..1,1,Sales order reference,An identifier of a referenced sales order issued by the Seller.,Document Reference,受注参照,売り手が発行した受注を参照する場合の当該受注に記載の文書番号。,1200,cbc:SalesOrderID,udt:IdentifierType,/Invoice/cac:OrderReference/cbc:SalesOrderID,0..1
1150,ibt-015,0..1,1,Receiving advice reference,An identifier of a referenced receiving advice.,Document Reference,受取通知書参照,参照する受取通知書に買い手が付番した番号。,1280,cbc:ID,udt:IdentifierType,/Invoice/cac:ReceiptDocumentReference/cbc:ID,1..1
1160,ibt-016,0..1,1,Despatch advice reference,An identifier of a referenced despatch advice.,Document Reference,出荷案内書参照,参照する出荷案内書に売り手が付番した番号。,1260,cbc:ID,udt:IdentifierType,/Invoice/cac:DespatchDocumentReference/cbc:ID,1..1
1170,ibt-017,0..1,1,Tender or lot reference,The identification of the call for tender or lot the invoice relates to.,Document Reference,入札又はロット参照,参照する入札またはロットの番号。,1300,cbc:ID,udt:IdentifierType,/Invoice/cac:OriginatorDocumentReference/cbc:ID,1..1
1180,ibt-018,0..1,1,Invoiced object identifier,"An identifier for an object on which the invoice is based	 given by the Seller.",Identifier,請求するオブジェクトID,請求書の根拠となるIDで、売り手が指定。請求書の根拠となるオブジェクトのIDで、売り手が指定したもの。,1340,cbc:ID,udt:IdentifierType,/Invoice/cac:AdditionalDocumentReference[cbc:DocumentTypeCode='130']/cbc:ID,1..1
1190,ibt-018-1,0..1,2,The identification scheme identifier of the Invoiced object identifier.,"If it may be not clear for the receiver what scheme is used for the identifier	 a conditional scheme identifier should be used that shall be chosen from the UNTDID 1153 code list [6] entries.",String,請求するオブジェクトIDのスキーマID,受信者にとって、IDにどのスキーマが使用されているかが明確でない場合は、UNTDID1153コードリストから選択される条件付きスキーマIDを使用する必要がある。,1350,@schemeID,xsd:normalizedString,/Invoice/cac:AdditionalDocumentReference[cbc:DocumentTypeCode='130']/cbc:ID/@schemeID,0..1
1200,ibt-019,0..1,1,Buyer accounting reference,A textual value that specifies where to book the relevant data into the Buyer’s financial accounts.,Text,買い手会計参照,買い手の財務勘定科目に関連データを記帳する場所を指定する。買い手のどの勘定に関連データを記帳すべきかを指定するためのテキスト値。,1120,cbc:AccountingCost,udt:TextType,/Invoice/cbc:AccountingCost,0..1
1210,ibg-33,0..n,1,INVOICE TERMS,Information about the terms that apply to the settlement of the invoice amount.,,支払条件,請求金額の決済に適用される条件に関する情報。,2920,cac:PaymentTerms,cac:PaymentTermsType,/Invoice/cac:PaymentTerms,0..n
1220,ibt-187,0..1,2,Terms payment instructions ID,The payment instructions that apply to these payment terms.,Identifier,支払条件指示ID,これらの支払条件を適用する支払指示。,2930,cbc:PaymentMeansID,udt:IdentifierType,/Invoice/cac:PaymentTerms/cbc:PaymentMeansID,0..n
1230,ibt-020,0..1,2,Payment terms,A textual description of the payment terms that apply to the amount due for payment (Including description of possible penalties).,Text,支払条件,支払額に適用される支払条件の説明(罰則の記載を含む)。支払条件の文字による説明。,2940,cbc:Note,udt:TextType,/Invoice/cac:PaymentTerms/cbc:Note,0..n
1240,ibt-176,0..1,2,Terms amount,The payment amount that these terms apply to.,Amount,支払条件金額,これらの条件が適用される支払金額。,2950,cbc:Amount,udt:AmountType,/Invoice/cac:PaymentTerms/cbc:Amount,0..1
1250,ibt-177,0..1,2,Terms installment due date,The date before end of which the terms amount shall be settled.,Date,分割支払支払期日,分割支払の場合の各支払期日。,2960,cbc:InstallmentDueDate,udt:DateType,/Invoice/cac:PaymentTerms/cbc:InstallmentDueDate,0..1
1260,ibt-022,0..1,1,Invoice note,A textual note that gives unstructured information that is relevant to the Invoice as a whole.,Text,請求書注釈内容,注釈の内容を入力するフリースペース。,1080,cbc:Note,udt:TextType,/Invoice/cbc:Note,0..n
1270,ibg-02,1..1,1,PROCESS CONTROL,A group of business terms providing information on the business process and rules applicable to the Invoice document.,,プロセスコントロール,請求書に適用するビジネスプロセス及びルールについての情報を提供するビジネス用語のグループ。,4570,_,_,_,_
1280,ibt-023,1..1,2,Business process type,"Identifies the business process context in which the transaction appears	 to enable the Buyer to process the Invoice in an appropriate way.",Text,ビジネスプロセスタイプ,取引プロセスの名称。買い手が適切な方法で請求書を処理することができるように、取引が行われたビジネスプロセスを識別する。,1020,cbc:ProfileID,udt:IdentifierType,/Invoice/cbc:ProfileID,0..1
1290,ibt-024,1..1,2,Specification identifier,"An identification of the specification containing the total set of rules regarding semantic content	 cardinalities and business rules to which the data contained in the instance document conforms.",Identifier,仕様ID,取引プロセスのID。セマンティックコンテンツ、カーディナリティや、インスタンス文書に含まれているデータが準拠すべきビジネスルールに関するルール一式を含む、仕様を識別する。,1010,cbc:CustomizationID,udt:IdentifierType,/Invoice/cbc:CustomizationID,0..1
1300,ibg-03,0..n,1,PRECEDING INVOICE REFERENCE,A group of business terms providing information on one or more preceding Invoices.,,先行請求書への参照,1つのあるいはそれ以上の先行請求書に関する情報を提供するビジネス用語のグループ。,1210,cac:BillingReference,cac:BillingReferenceType,/Invoice/cac:BillingReference,0..n
1310,ibt-025,1..1,2,Preceding Invoice reference,The identification of an Invoice that was previously sent by the Seller.,Document Reference,先行請求書への参照,売り手が以前に送付した請求書番号。,1230,cbc:ID,udt:IdentifierType,/Invoice/cac:BillingReference/cac:InvoiceDocumentReference/cbc:ID,1..1
1320,ibt-026,0..1,2,Preceding Invoice issue date,The date when the Preceding Invoice was issued.,Date,先行請求書発行日,先行請求書の発行日。,1240,cbc:IssueDate,udt:DateType,/Invoice/cac:BillingReference/cac:InvoiceDocumentReference/cbc:IssueDate,0..1
1330,ibg-04,1..1,1,SELLER,A group of business terms providing information about the Seller.,,売り手,売り手に係る情報を提供するビジネス用語のグループ。,1470,cac:AccountingSupplierParty,cac:SupplierPartyType,/Invoice/cac:AccountingSupplierParty,1..1
1340,ibt-027,1..1,2,Seller name,The full formal name by which the Seller is registered in the national registry of legal entities or as a Taxable person or otherwise trades as a person or persons.,Text,売り手名称,売り手が所在国の法人登録簿に法人、または課税対象者として登録されている、またはその他の方法で1人または複数の人として登録されている完全な正式名称。,1780,cbc:RegistrationName,udt:NameType,/Invoice/cac:AccountingSupplierParty/cac:Party/cac:PartyLegalEntity/cbc:RegistrationName,0..1
1350,ibt-028,0..1,2,Seller trading name,"A name by which the Seller is known	 other than Seller name (also known as Business name).",Text,売り手商号,売り手名称以外で、知られているビジネス上の名称（商号ともよばれる）。,1580,cbc:Name,udt:NameType,/Invoice/cac:AccountingSupplierParty/cac:Party/cac:PartyName/cbc:Name,1..1
1360,ibt-029,0..n,2,Seller identifier,An identification of the Seller.,Identifier,売り手ID,売り手を表すID。,1550,cbc:ID,udt:IdentifierType,/Invoice/cac:AccountingSupplierParty/cac:Party/cac:PartyIdentification/cbc:ID[not(@schemeID='SEPA')],1..1
1370,ibt-029-1,0..1,3,Seller identifier Scheme identifier,"If used, the identification scheme identifier shall be chosen from the entries of the list published by the ISO/IEC 6523 maintenance agency.",String,スキーマID,使用する場合、識別スキーマは、ISO/IEC6523保守機関として公開されているリストから選択しなければならない。,1560,@schemeID,xsd:normalizedString,/Invoice/cac:AccountingSupplierParty/cac:Party/cac:PartyIdentification/cbc:ID[not(@schemeID='SEPA')]/@schemeID,0..1
1380,ibt-030,0..1,2,Seller legal registration identifier,An identifier issued by an official registrar that identifies the Seller as a legal entity or person.,Identifier,売り手法人ID,公的機関が発行した売り手を法人や個人として識別するID。,1790,cbc:CompanyID,udt:IdentifierType,/Invoice/cac:AccountingSupplierParty/cac:Party/cac:PartyLegalEntity/cbc:CompanyID,0..1
1390,ibt-030-1,0..1,3,Seller legal registration identifier Scheme identifier,,String,スキーマID,,1800,@schemeID,udt:IdentifierType,/Invoice/cac:AccountingSupplierParty/cac:Party/cac:PartyLegalEntity/cbc:CompanyID/@schemeID,0..1
1400,ibt-031,0..1,2,Seller TAX identifier,The Seller’s TAX identifier (also known as Seller TAX identification number).,Identifier,売り手税ID,売り手の税ID(売り手の税識別番号ともよばれる）。,1700,cbc:CompanyID,udt:IdentifierType,/Invoice/cac:AccountingSupplierParty/cac:Party/cac:PartyTaxScheme/cbc:CompanyID,0..1
1405,ibt-031q,0..1,2,Qualifier for the type of the seller tax identifier,,Identifier,,,1710,cbc:ID,udt:IdentifierType,/Invoice/cac:AccountingSupplierParty/cac:Party/cac:PartyTaxScheme/cac:TaxScheme/cbc:ID,0..1
1410,ibt-032,0..1,2,Seller TAX registration identifier,The local identification (defined by the Seller’s address) of the Seller for tax purposes or a reference that enables the Seller to state his registered tax status.,Identifier,売り手税登録ID,税務上の売り手の所在地における登録ID（売り手の住所で定義された値）。または売り手が登録済みの税務状況を示すことを可能にする参照ID。,1740,cbc:CompanyID,udt:IdentifierType,/Invoice/cac:AccountingSupplierParty/cac:Party/cac:PartyTaxScheme[cac:TaxScheme/cbc:ID!='VAT']/cbc:CompanyID,0..1
1415,ibt-032q,0..1,2,Qualifier for the type of the seller tax identifier,,Identifier,,,1750,cbc:ID,udt:IdentifierType,/Invoice/cac:AccountingSupplierParty/cac:Party/cac:PartyTaxScheme[cac:TaxScheme/cbc:ID!='VAT']/cac:TaxScheme/cbc:ID,0..1
1420,ibt-033,0..1,2,Seller additional legal information,Additional legal information relevant for the Seller.,Text,売り手追加法的情報,売り手に関する追加の法的情報。,1810,cbc:CompanyLegalForm,udt:TextType,/Invoice/cac:AccountingSupplierParty/cac:Party/cac:PartyLegalEntity/cbc:CompanyLegalForm,0..1
1430,ibt-034,1..1,2,Seller electronic address,Identifies the Seller’s electronic address to which the application level response to the invoice may be delivered.,Identifier,売り手電子アドレス,請求書に対するアプリケーションレベルの応答が配信される売り手の電子アドレスを識別する。,1490,cbc:EndpointID,udt:IdentifierType,/Invoice/cac:AccountingSupplierParty/cac:Party/cbc:EndpointID,0..1
1440,ibt-034-1,1..1,3,Seller electronic address Scheme identifier,The scheme identifier shall be chosen from a list to be maintained by the Connecting Europe Facility.,String,スキーマID,スキーマIDは、Connecting Europe Facility (CEF) が管理するリストから選択しなければならない。,1500,@schemeID,xsd:normalizedString,/Invoice/cac:AccountingSupplierParty/cac:Party/cbc:EndpointID/@schemeID,0..1
1450,ibt-090,0..1,3,Bank assigned creditor identifier,Unique banking reference identifier of the Payee or Seller assigned by the Payee or Seller bank.,Identifier,銀行が採番した債権者の識別子,売り手や支払先の取引銀行が一意に割り当てた売り手や支払先の銀行参照識別子。,1520,cbc:ID,udt:IdentifierType,/Invoice/cac:AccountingSupplierParty/cac:Party/cac:PartyIdentification/cbc:ID[@schemeID='SEPA'],1..1
1460,ibg-05,1..1,2,SELLER POSTAL ADDRESS,A group of business terms providing information about the address of the Seller.,,売り手住所,売り手の住所に関する情報を提供するビジネス用語のグループ。,1590,cac:PostalAddress,cac:AddressType,/Invoice/cac:AccountingSupplierParty/cac:Party/cac:PostalAddress,0..1
1470,ibt-035,0..1,3,Seller address line 1,The main address line in an address.,Text,売り手住所欄1,売り手の住所の主な記載欄。,1600,cbc:StreetName,udt:NameType,/Invoice/cac:AccountingSupplierParty/cac:Party/cac:PostalAddress/cbc:StreetName,0..1
1480,ibt-036,0..1,3,Seller address line 2,An additional address line in an address that can be used to give further details supplementing the main line.,Text,売り手住所欄2,売り手の住所の主な記載内容に加えて詳細な情報のために使用する追加記載欄。,1610,cbc:AdditionalStreetName,udt:NameType,/Invoice/cac:AccountingSupplierParty/cac:Party/cac:PostalAddress/cbc:AdditionalStreetName,0..1
1490,ibt-162,0..1,3,Seller address line 3,An additional address line in an address that can be used to give further details supplementing the main line.,Text,売り手住所欄3,売り手の住所の上記の記載内容に加えてより詳細な情報のために使用する追加記載欄。,1660,cbc:Line,udt:TextType,/Invoice/cac:AccountingSupplierParty/cac:Party/cac:PostalAddress/cac:AddressLine/cbc:Line,1..1
1500,ibt-037,0..1,3,Seller city,"The common name of the city	 town or village	 where the Seller address is located.",Text,売り手住所 市区町村,売り手が所在する市、町、村の通称。,1620,cbc:CityName,udt:NameType,/Invoice/cac:AccountingSupplierParty/cac:Party/cac:PostalAddress/cbc:CityName,0..1
1510,ibt-038,0..1,3,Seller post code,The identifier for an addressable group of properties according to the relevant postal service.,Text,売り手郵便番号,売り手の住所の郵便番号。,1630,cbc:PostalZone,udt:TextType,/Invoice/cac:AccountingSupplierParty/cac:Party/cac:PostalAddress/cbc:PostalZone,0..1
1520,ibt-039,0..1,3,Seller country subdivision,The subdivision of a country.,Text,売り手住所 都道府県,売り手の住所の地方区分。,1640,cbc:CountrySubentity,udt:TextType,/Invoice/cac:AccountingSupplierParty/cac:Party/cac:PostalAddress/cbc:CountrySubentity,0..1
1530,ibt-040,1..1,3,Seller country code,A code that identifies the country.,Code,売り手国コード,売り手の住所の国コード。,1680,cbc:IdentificationCode,udt:CodeType,/Invoice/cac:AccountingSupplierParty/cac:Party/cac:PostalAddress/cac:Country/cbc:IdentificationCode,0..1
1540,ibg-06,0..1,2,SELLER CONTACT,A group of business terms providing contact information about the Seller.,,売り手連絡先,売り手の連絡先に係る情報を提供するビジネス用語のグループ。,1820,cac:Contact,cac:ContactType,/Invoice/cac:AccountingSupplierParty/cac:Party/cac:Contact,0..1
1550,ibt-041,0..1,3,Seller contact point,A contact point for a legal entity or person.,Text,売り手連絡先,売り手の連絡先の個人の、文字で表現された名前（部門名を含む）。,1830,cbc:Name,udt:NameType,/Invoice/cac:AccountingSupplierParty/cac:Party/cac:Contact/cbc:Name,0..1
1560,ibt-042,0..1,3,Seller contact telephone number,A phone number for the contact point.,Text,売り手連絡先電話番号,売り手の連絡先電話番号。,1840,cbc:Telephone,udt:TextType,/Invoice/cac:AccountingSupplierParty/cac:Party/cac:Contact/cbc:Telephone,0..1
1570,ibt-043,0..1,3,Seller contact email address,An e-mail address for the contact point.,Text,売り手連絡先電子メールアドレス,売り手の連絡先電子メールアドレス。,1850,cbc:ElectronicMail,udt:TextType,/Invoice/cac:AccountingSupplierParty/cac:Party/cac:Contact/cbc:ElectronicMail,0..1
1580,ibg-07,1..1,1,BUYER,A group of business terms providing information about the Buyer.,,買い手,買い手に係る情報を提供するビジネス用語のグループ。,1860,cac:AccountingCustomerParty,cac:CustomerPartyType,/Invoice/cac:AccountingCustomerParty,1..1
1590,ibt-044,1..1,2,Buyer name,The full name of the Buyer.,Text,買い手名称,買い手の名称。,2110,cbc:RegistrationName,udt:NameType,/Invoice/cac:AccountingCustomerParty/cac:Party/cac:PartyLegalEntity/cbc:RegistrationName,0..1
1600,ibt-045,0..1,2,Buyer trading name,"A name by which the Buyer is known	 other than Buyer name (also known as Business name).",Text,買い手商号,買い手名称以外で、知られているビジネス上の名称。,1940,cbc:Name,udt:NameType,/Invoice/cac:AccountingCustomerParty/cac:Party/cac:PartyName/cbc:Name,1..1
1610,ibt-046,0..1,2,Buyer identifier,An identifier of the Buyer.,Identifier,買い手ID,買い手を表すID。,1910,cbc:ID,udt:IdentifierType,/Invoice/cac:AccountingCustomerParty/cac:Party/cac:PartyIdentification/cbc:ID,1..1
1620,ibt-046-1,0..1,3,Buyer identifier Scheme identifier,"If used	 the identification scheme shall be chosen from the entries of the list published by the ISO/IEC 6523 maintenance agency.",String,スキーマID,使用する場合、識別スキーマは、ISO/IEC6523保守機関として公開されているリストから選択しなければならない。,1920,@schemeID,xsd:normalizedString,/Invoice/cac:AccountingCustomerParty/cac:Party/cac:PartyIdentification/cbc:ID/@schemeID,0..1
1630,ibt-047,0..1,2,Buyer legal registration identifier,An identifier issued by an official registrar that identifies the Buyer as a legal entity or person.,Identifier,買い手法人ID,買い手を表す法人ID。,2120,cbc:CompanyID,udt:IdentifierType,/Invoice/cac:AccountingCustomerParty/cac:Party/cac:PartyLegalEntity/cbc:CompanyID,0..1
1640,ibt-047-1,0..1,3,Buyer legal registration identifier Scheme identifier,"If used	 the identification scheme shall be chosen from the entries of the list published by the ISO/IEC 6523 maintenance agency.",String,スキーマID,使用する場合、識別スキーマは、ISO/IEC6523保守機関として公開されているリストから選択しなければならない。,2130,@schemeID,xsd:normalizedString,/Invoice/cac:AccountingCustomerParty/cac:Party/cac:PartyLegalEntity/cbc:CompanyID/@schemeID,0..1
1650,ibt-048,0..1,2,Buyer TAX identifier,The Buyer’s TAX identifier (also known as Buyer TAX identification number).,Identifier,買い手税ID,買い手の税ID番号。日本の場合は、適格請求書発行事業者登録番号。,2060,cbc:CompanyID,udt:IdentifierType,/Invoice/cac:AccountingCustomerParty/cac:Party/cac:PartyTaxScheme/cbc:CompanyID,0..1
1655,ibt-048q,0..1,2,Qualifier for the type of the buyer tax identifier,,Identifier,,,2070,cbc:ID,udt:IdentifierType,/Invoice/cac:AccountingCustomerParty/cac:Party/cac:PartyTaxScheme/cac:TaxScheme/cbc:ID,0..1
1660,ibt-049,1..1,2,Buyer electronic address,Identifies the Buyer’s electronic address to which the invoice is delivered.,Identifier,買い手電子アドレス,請求書の送信先となる買い手の電子アドレスを識別する。,1880,cbc:EndpointID,udt:IdentifierType,/Invoice/cac:AccountingCustomerParty/cac:Party/cbc:EndpointID,0..1
1670,ibt-049-1,1..1,3,Buyer electronic address Scheme identifier,The scheme identifier shall be chosen from a list to be maintained by the Connecting Europe Facility.,String,スキーマID,スキーマIDは、Connecting Europe Facility (CEF) が管理するリストから選択しなければならない。,1890,@schemeID,xsd:normalizedString,/Invoice/cac:AccountingCustomerParty/cac:Party/cbc:EndpointID/@schemeID,0..1
1680,ibg-08,1..1,2,BUYER POSTAL ADDRESS,A group of business terms providing information about the postal address for the Buyer.,,買い手住所,買い手の住所に関する情報を提供するビジネス用語のグループ。,1950,cac:PostalAddress,cac:AddressType,/Invoice/cac:AccountingCustomerParty/cac:Party/cac:PostalAddress,0..1
1690,ibt-050,0..1,3,Buyer address line 1,The main address line in an address.,Text,買い手住所欄1,買い手の住所の主な記載欄。,1960,cbc:StreetName,udt:NameType,/Invoice/cac:AccountingCustomerParty/cac:Party/cac:PostalAddress/cbc:StreetName,0..1
1700,ibt-051,0..1,3,Buyer address line 2,An additional address line in an address that can be used to give further details supplementing the main line.,Text,買い手住所欄2,買い手の住所の主な記載内容に加えて詳細な情報のために使用する追加記載欄。,1970,cbc:AdditionalStreetName,udt:NameType,/Invoice/cac:AccountingCustomerParty/cac:Party/cac:PostalAddress/cbc:AdditionalStreetName,0..1
1710,ibt-163,0..1,3,Buyer address line 3,An additional address line in an address that can be used to give further details supplementing the main line.,Text,買い手住所欄3,買い手の住所の上記の記載内容に加えてより詳細な情報のために使用する追加記載欄。,2020,cbc:Line,udt:TextType,/Invoice/cac:AccountingCustomerParty/cac:Party/cac:PostalAddress/cac:AddressLine/cbc:Line,1..1
1720,ibt-052,0..1,3,Buyer city,"The common name of the city	 town or village	 where the Buyer’s address is located.",Text,買い手住所 市区町村,買い手が所在する市、町、村の通称。,1980,cbc:CityName,udt:NameType,/Invoice/cac:AccountingCustomerParty/cac:Party/cac:PostalAddress/cbc:CityName,0..1
