semSort,id,card,level,businessTerm,desc,dataType,businessTerm_ja,desc_ja,synSort,element,synDatatype,xPath,occur
2490,ibt-095,1..1,2,Document level allowance TAX category code,A coded identification of what TAX category applies to the document level allowance.,Code,請求書レベルの返金の課税分類コード,請求書レベルの返金に適用される課税分類コード。,3120,cbc:ID,udt:IdentifierType,/Invoice/cac:AllowanceCharge[cbc:ChargeIndicator=false()]/cac:TaxCategory/cbc:ID,0..1
2500,ibt-095-1,1..1,2,Document level allowance TAX category code Tax Scheme,,Code,,,3180,cbc:ID,udt:IdentifierType,/Invoice/cac:AllowanceCharge[cbc:ChargeIndicator=false()]/cac:TaxCategory/cac:TaxScheme/cbc:ID,1..1
2510,ibt-096,0..1,2,Document level allowance TAX rate,"The TAX rate	 represented as percentage that applies to the document level allowance.",Percentage,請求書レベルの返金の税率,請求書レベルの返金に適用される消費税率(パーセント)。,3140,cbc:Percent,udt:PercentType,/Invoice/cac:AllowanceCharge[cbc:ChargeIndicator=false()]/cac:TaxCategory/cbc:Percent,0..1
2520,ibt-196,0..0,2,Document level allowance TAX exemption reason code,A coded statement of the reason for why the document level allowance amount is exempted from TAX.,Code,請求書レベルの返金の非課税理由テキスト,請求書レベルの返金が非課税または課税されない理由をテキストで表現。,3150,cbc:TaxExemptionReasonCode,udt:CodeType,/Invoice/cac:AllowanceCharge[cbc:ChargeIndicator=false()]/cac:TaxCategory/cbc:TaxExemptionReasonCode,0..1
2530,ibt-197,0..0,2,Document level allowance TAX exemption reason text,A textual statement of the reason why the document level allowance amount is exempted from TAX or why no TAX is being charged.,Text,請求書レベルの返金の非課税理由コード,請求書レベルの返金が非課税または課税されない理由をコードで表現。,3160,cbc:TaxExemptionReason,udt:TextType,/Invoice/cac:AllowanceCharge[cbc:ChargeIndicator=false()]/cac:TaxCategory/cbc:TaxExemptionReason,0..n
2540,ibg-21,0..n,1,DOCUMENT LEVEL CHARGES,"A group of business terms providing information about charges and taxes other than TAX	 applicable to the Invoice as a whole.",,請求書レベルの追加請求,請求書レベルの追加請求や追加税(消費税以外)に関する情報を提供するビジネス用語のグループ。,3190,cac:AllowanceCharge,cac:AllowanceChargeType,/Invoice/cac:AllowanceCharge[cbc:ChargeIndicator=true()],0..n
2545,ibt-099a,1..1,2,Syntax qualifier for the document level charge,,Indicator,,,3200,cbc:ChargeIndicator,xsd:boolean,/Invoice/cac:AllowanceCharge[cbc:ChargeIndicator=true()]/cbc:ChargeIndicator,1..1
2550,ibt-099,1..1,2,Document level charge amount,"The amount of a charge	 without TAX.",Amount,請求書レベルの追加請求金額(税抜き),追加請求金額(税抜き)。,3240,cbc:Amount,udt:AmountType,/Invoice/cac:AllowanceCharge[cbc:ChargeIndicator=true()]/cbc:Amount,1..1
2560,ibt-100,0..1,2,Document level charge base amount,"The base amount that may be used	 in conjunction with the document level charge percentage	 to calculate the document level charge amount.",Amount,請求書レベルの追加請求金額の基準となる金額,請求書レベルの追加請求率を乗じて請求書レベルの追加請求金額を算出する際に使用される基準金額。,3260,cbc:BaseAmount,udt:AmountType,/Invoice/cac:AllowanceCharge[cbc:ChargeIndicator=true()]/cbc:BaseAmount,0..1
2570,ibt-101,0..1,2,Document level charge percentage,"The percentage that may be used	 in conjunction with the document level charge base amount	 to calculate the document level charge amount.",Percentage,請求書レベルの追加請求の率,請求書レベルの追加請求基準金額に乗じて請求書レベルの追加請求金額を算出するために使用されるパーセント。,3230,cbc:MultiplierFactorNumeric,udt:NumericType,/Invoice/cac:AllowanceCharge[cbc:ChargeIndicator=true()]/cbc:MultiplierFactorNumeric,0..1
2580,ibt-104,0..1,2,Document level charge reason,"The reason for the document level charge	 expressed as text.",Text,請求書レベルの追加請求の理由,請求書レベルの追加請求の理由をテキストで表現。,3220,cbc:AllowanceChargeReason,udt:TextType,/Invoice/cac:AllowanceCharge[cbc:ChargeIndicator=true()]/cbc:AllowanceChargeReason,0..n
2590,ibt-105,0..1,2,Document level charge reason code,"The reason for the document level charge	 expressed as a code.",Code,請求書レベルの追加請求の理由コード,請求書レベルの追加請求の理由コード。,3210,cbc:AllowanceChargeReasonCode,udt:CodeType,/Invoice/cac:AllowanceCharge[cbc:ChargeIndicator=true()]/cbc:AllowanceChargeReasonCode,0..1
2600,ibt-102,1..1,2,Document level charge TAX category code,A coded identification of what TAX category applies to the document level charge.,Code,請求書レベルの追加請求の課税分類コード,請求書レベルの追加請求に適用される課税分類コード。,3290,cbc:ID,udt:IdentifierType,/Invoice/cac:AllowanceCharge[cbc:ChargeIndicator=true()]/cac:TaxCategory/cbc:ID,0..1
2605,ibt-102-1,1..1,2,Document level charge TAX category code Tax Scheme,,String,,,3340,cbc:ID,udt:IdentifierType,/Invoice/cac:AllowanceCharge[cbc:ChargeIndicator=true()]/cac:TaxCategory/cac:TaxScheme/cbc:ID,0..1
2610,ibt-103,0..1,2,Document level charge TAX rate,"The TAX rate	 represented as percentage that applies to the document level charge.",Percentage,請求書レベルの追加請求の税率,請求書レベルの追加請求に適用される消費税率(パーセント)。,3300,cbc:Percent,udt:PercentType,/Invoice/cac:AllowanceCharge[cbc:ChargeIndicator=true()]/cac:TaxCategory/cbc:Percent,0..1
2620,ibt-198,0..0,2,Document level charge TAX exemption reason code,A coded statement of the reason for why the document level charge amount is exempted from TAX.,Code,請求書レベルの追加請求の非課税理由テキスト,請求書レベルの追加請求が非課税または課税されない理由をテキストで表現。,3310,cbc:TaxExemptionReasonCode,udt:CodeType,/Invoice/cac:AllowanceCharge[cbc:ChargeIndicator=true()]/cac:TaxCategory/cbc:TaxExemptionReasonCode,0..1
2630,ibt-199,0..0,2,Document level charge TAX exemption reason text,A textual statement of the reason why the document level charge amount is exempted from TAX or why no TAX is being charged,Text,請求書レベルの追加請求の非課税理由コード,請求書レベルの追加請求が非課税または課税されない理由をコードで表現。,3320,cbc:TaxExemptionReason,udt:TextType,/Invoice/cac:AllowanceCharge[cbc:ChargeIndicator=true()]/cac:TaxCategory/cbc:TaxExemptionReason,0..n
2640,ibg-22,1..1,1,DOCUMENT TOTALS,A group of business terms providing the monetary totals for the Invoice.,,請求書総合計金額,請求書合計金額に係る情報を提供するビジネス用語のグループ。,3590,cac:LegalMonetaryTotal,cac:MonetaryTotalType,/Invoice/cac:LegalMonetaryTotal,1..1
2650,ibt-106,1..1,2,Sum of Invoice line net amount,Sum of all Invoice line net amounts in the Invoice.,Amount,値引後請求書明細行金額の合計,値引後明細行金額の合計金額。,3600,cbc:LineExtensionAmount,udt:AmountType,/Invoice/cac:LegalMonetaryTotal/cbc:LineExtensionAmount,1..1
2660,ibt-107,0..1,2,Sum of allowances on document level,Sum of all allowances on document level in the Invoice.,Amount,請求書レベルの返金の合計,請求書レベルの返金の合計。,3660,cbc:AllowanceTotalAmount,udt:AmountType,/Invoice/cac:LegalMonetaryTotal/cbc:AllowanceTotalAmount,0..1
2670,ibt-108,0..1,2,Sum of charges on document level,Sum of all charges on document level in the Invoice.,Amount,請求書レベルの追加請求の合計,請求書レベルの追加請求の合計。,3680,cbc:ChargeTotalAmount,udt:AmountType,/Invoice/cac:LegalMonetaryTotal/cbc:ChargeTotalAmount,0..1
2680,ibt-109,1..1,2,Invoice total amount without TAX,The total amount of the Invoice without TAX.,Amount,請求書合計金額(税抜き),請求書合計金額(税抜き)。,3620,cbc:TaxExclusiveAmount,udt:AmountType,/Invoice/cac:LegalMonetaryTotal/cbc:TaxExclusiveAmount,0..1
2690,ibt-110,1..1,2,Invoice total TAX amount,The total TAX amount for the Invoice.,Amount,請求書消費税合計金額,請求書消費税合計金額。,3360,cbc:TaxAmount,udt:AmountType,/Invoice/cac:TaxTotal[cbc:TaxAmount/@currencyID=/Invoice/cbc:DocumentCurrencyCode]/cbc:TaxAmount,1..1
2700,ibt-112,1..1,2,Invoice total amount with TAX,The total amount of the Invoice with tax.,Amount,請求書合計金額(税込み),請求書合計金額(税込み)。,3640,cbc:TaxInclusiveAmount,udt:AmountType,/Invoice/cac:LegalMonetaryTotal/cbc:TaxInclusiveAmount,0..1
2710,ibt-113,0..1,2,Paid amount,The sum of amounts which have been paid in advance.,Amount,支払済金額,事前に支払われた金額の合計。,3700,cbc:PrepaidAmount,udt:AmountType,/Invoice/cac:LegalMonetaryTotal/cbc:PrepaidAmount,0..1
2720,ibt-114,0..1,2,Rounding amount,The amount to be added to the invoice total to round the amount to be paid.,Amount,丸めるための金額,支払金額に丸めるために請求書の合計金額に追加される金額。,3720,cbc:PayableRoundingAmount,udt:AmountType,/Invoice/cac:LegalMonetaryTotal/cbc:PayableRoundingAmount,0..1
2730,ibt-115,1..1,2,Amount due for payment,The outstanding amount that is requested to be paid.,Amount,差引請求金額,買い手が支払を要求されている差引請求金額。,3740,cbc:PayableAmount,udt:AmountType,/Invoice/cac:LegalMonetaryTotal/cbc:PayableAmount,1..1
2740,ibg-37,0..1,1,DOCUMENT TOTALS IN TAX ACCOUNTING CURRENCY,A group of business terms providing the monetary totals for the Invoice in the tax accounting currency.,,会計通貨での請求書総合計金額,請求書の合計金額を税務会計通貨で提供するビジネス用語のグループ。,3500,cac:TaxTotal,cac:TaxTotalType,/Invoice/cac:TaxTotal[cbc:TaxAmount/@currencyID=/Invoice/cbc:TaxCurrencyCode],0..n
2750,ibt-111,0..1,2,Invoice total TAX amount in tax accounting currency,The TAX total amount expressed in the accounting currency accepted or required in the country of the Seller.,Amount,会計通貨での請求書消費税合計金額,売り手の国で認められた、又は要求された会計通貨での消費税合計金額。,3510,cbc:TaxAmount,udt:AmountType,/Invoice/cac:TaxTotal[cbc:TaxAmount/@currencyID=/Invoice/cbc:TaxCurrencyCode]/cbc:TaxAmount,1..1
2760,ibg-38,1..n,2,TAX BREAKDOWN IN ACCOUNTING CURRENCY,"A group of business terms providing information about TAX breakdown by different categories	 rates and exemption reasons in the invoice accounting currency.",,会計通貨での税内訳情報,請求書の会計通貨でのさまざまな課税分類、税率、および免税理由による消費税の内訳に関する情報を提供するビジネス用語のグループ。,3530,cac:TaxSubtotal,cac:TaxSubtotalType,/Invoice/cac:TaxTotal[cbc:TaxAmount/@currencyID=/Invoice/cbc:TaxCurrencyCode]/cac:TaxSubtotal,0..n
2770,ibt-190,0..1,3,TAX category tax amount in accounting currency,The total TAX amount for a given TAX category in the invoice accounting currency.,Amount,会計通貨での課税分類毎の消費税額,課税分類での請求書消費税合計の会計通貨での金額。,3540,cbc:TaxAmount,udt:AmountType,/Invoice/cac:TaxTotal[cbc:TaxAmount/@currencyID=/Invoice/cbc:TaxCurrencyCode]/cac:TaxSubtotal/cbc:TaxAmount,1..1
2780,ibt-192,1..1,3,TAX category code for tax category tax amount in accounting currency,Coded identification of a TAX category in the invoice accounting currency.,Code,会計通貨での課税分類コード, 請求書会計通貨での課税分類のコード化された識別子。,3570,cbc:ID,udt:IdentifierType,/Invoice/cac:TaxTotal[cbc:TaxAmount/@currencyID=/Invoice/cbc:TaxCurrencyCode]/cac:TaxSubtotal/cac:TaxCategory/cbc:ID,0..1
2790,ibt-193,0..1,3,TAX category rate for tax category tax amount in accounting currency,"The TAX rate	 represented as percentage that applies for the relevant TAX category in the invoice accounting currency.",Percentage,会計通貨での課税分類毎の税率,会計通貨での該当する課税分類に適用されるパーセンテージとして表した税率。,3580,cbc:Percent,udt:PercentType,/Invoice/cac:TaxTotal[cbc:TaxAmount/@currencyID=/Invoice/cbc:TaxCurrencyCode]/cac:TaxSubtotal/cac:TaxCategory/cbc:Percent,0..1
2795,ibt-193a,1..1,3,An identifier for this taxation scheme,An identifier for the taxation scheme within which this tax category is defined.,Code,,,3585,cbc:ID,udt:IdentifierType,/Invoice/cac:TaxTotal[cbc:TaxAmount/@currencyID=/Invoice/cbc:TaxCurrencyCode]/cac:TaxSubtotal/cac:TaxCategory/cac:TaxScheme/cbc:ID,0..1
2800,ibg-23,1..n,1,TAX BREAKDOWN,"A group of business terms providing information about TAX breakdown by different categories	 rates and exemption reasons",,税内訳情報,課税分類、消費税率、非課税/不課税理由毎の、消費税内訳に関する情報を提供するビジネス用語のグループ。,3380,cac:TaxSubtotal,cac:TaxSubtotalType,/Invoice/cac:TaxTotal[cbc:TaxAmount/@currencyID=/Invoice/cbc:DocumentCurrencyCode]/cac:TaxSubtotal,0..n
2810,ibt-116,1..1,2,TAX category taxable amount,Sum of all taxable amounts subject to a specific TAX category code and TAX category rate (if the TAX category rate is applicable).,Amount,課税分類毎の課税基準額,課税分類/課税分類の消費税率毎の課税基準額の合計。,3390,cbc:TaxableAmount,udt:AmountType,/Invoice/cac:TaxTotal[cbc:TaxAmount/@currencyID=/Invoice/cbc:DocumentCurrencyCode]/cac:TaxSubtotal/cbc:TaxableAmount,0..1
2820,ibt-117,1..1,2,TAX category tax amount,The total TAX amount for a given TAX category.,Amount,課税分類毎の消費税額,課税分類毎の消費税額合計。,3410,cbc:TaxAmount,udt:AmountType,/Invoice/cac:TaxTotal[cbc:TaxAmount/@currencyID=/Invoice/cbc:DocumentCurrencyCode]/cac:TaxSubtotal/cbc:TaxAmount,1..1
2830,ibt-118,1..1,2,TAX category code,Coded identification of a TAX category.,Code,課税分類コード,消費税の課税分類属性(標準税率、軽減税率など)を識別するためのコード。,3440,cbc:ID,udt:IdentifierType,/Invoice/cac:TaxTotal[cbc:TaxAmount/@currencyID=/Invoice/cbc:DocumentCurrencyCode]/cac:TaxSubtotal/cac:TaxCategory/cbc:ID,0..1
2840,ibt-119,0..1,2,TAX category rate,"The TAX rate	 represented as percentage that applies for the relevant TAX category.",Percentage,課税分類毎の税率,課税分類毎の税額計算のための率。,3450,cbc:Percent,udt:PercentType,/Invoice/cac:TaxTotal[cbc:TaxAmount/@currencyID=/Invoice/cbc:DocumentCurrencyCode]/cac:TaxSubtotal/cac:TaxCategory/cbc:Percent,0..1
2850,ibt-120,0..0,2,TAX exemption reason text,A textual statement of the reason why the amount is exempted from TAX or why no TAX is being charged,Text,非課税理由テキスト,非課税または課税されない理由をテキストで表現。,3470,cbc:TaxExemptionReason,udt:TextType,/Invoice/cac:TaxTotal[cbc:TaxAmount/@currencyID=/Invoice/cbc:DocumentCurrencyCode]/cac:TaxSubtotal/cac:TaxCategory/cbc:TaxExemptionReason,0..n
2855,ibt-119a,1..1,2,An identifier for this taxation scheme,An identifier for the taxation scheme within which this tax category is defined.,Code,,,3480,cbc:ID,udt:IdentifierType,/Invoice/cac:TaxTotal[cbc:TaxAmount/@currencyID=/Invoice/cbc:DocumentCurrencyCode]/cac:TaxSubtotal/cac:TaxCategory/cac:TaxScheme/cbc:ID,0..1
2860,ibt-121,0..0,2,TAX exemption reason code,A coded statement of the reason for why the amount is exempted from TAX.,Code,非課税理由コード,非課税または課税されない理由をコードで表現。,3460,cbc:TaxExemptionReasonCode,udt:CodeType,/Invoice/cac:TaxTotal[cbc:TaxAmount/@currencyID=/Invoice/cbc:DocumentCurrencyCode]/cac:TaxSubtotal/cac:TaxCategory/cbc:TaxExemptionReasonCode,0..1
2870,ibg-24,0..n,1,ADDITIONAL SUPPORTING DOCUMENTS,A group of business terms providing information about additional supporting documents substantiating the claims made in the Invoice.,,添付書類,請求書内で行われたクレームを実証する添付書類についての情報を提供するビジネス用語のグループ。,1360,cac:AdditionalDocumentReference,cac:DocumentReferenceType,/Invoice/cac:AdditionalDocumentReference[not(cbc:DocumentTypeCode='130')],0..n
2880,ibt-122,1..1,2,Supporting document reference,An identifier of the supporting document.,Document Reference,添付書類への参照,添付書類のID。,1370,cbc:ID,udt:IdentifierType,/Invoice/cac:AdditionalDocumentReference[not(cbc:DocumentTypeCode='130')]/cbc:ID,1..1
2890,ibt-123,0..1,2,Supporting document description,A description of the supporting document.,Text,添付書類の説明,添付書類の説明。,1380,cbc:DocumentDescription,udt:TextType,/Invoice/cac:AdditionalDocumentReference[not(cbc:DocumentTypeCode='130')]/cbc:DocumentDescription,0..n
2900,ibt-125,0..1,2,Attached document,An attached document embedded as binary object or sent together with the invoice.,Binary object,添付書類,バイナリオブジェクトとして埋め込まれた、または請求書と一緒に送られた添付書類。,1400,cbc:EmbeddedDocumentBinaryObject,udt:BinaryObjectType,/Invoice/cac:AdditionalDocumentReference[not(cbc:DocumentTypeCode='130')]/cac:Attachment/cbc:EmbeddedDocumentBinaryObject,0..1
2910,ibt-125-1,1..1,3,Attached document Mime code,Allowed mime codes,String,添付書類MIMEコード,"許可されているMIMEコード:application/pdf,image/png,image/jpeg,text/csv,application/vnd.openxmlformats-officedocument.spreadsheetml.sheet,application/vnd.oasis.opendocument. Spreadsheet",1410,@mimeCode,xsd:normalizedString,/Invoice/cac:AdditionalDocumentReference[not(cbc:DocumentTypeCode='130')]/cac:Attachment/cbc:EmbeddedDocumentBinaryObject/@mimeCode,1..1
2920,ibt-125-2,1..1,3,Attached document Filename,ー,String,添付書類ファイル名,ー,1420,@filename,xsd:string,/Invoice/cac:AdditionalDocumentReference[not(cbc:DocumentTypeCode='130')]/cac:Attachment/cbc:EmbeddedDocumentBinaryObject/@filename,0..1
2930,ibt-124,0..1,2,External document location,The URL (Uniform Resource Locator) that identifies where the external document is located.,Text,外部ドキュメントのロケーション,外部ドキュメントの所在を示すURL（ユニフォームリソースロケータ）,1440,cbc:URI,udt:IdentifierType,/Invoice/cac:AdditionalDocumentReference[not(cbc:DocumentTypeCode='130')]/cac:Attachment/cac:ExternalReference/cbc:URI,0..1
2940,ibg-25,1..n,1,INVOICE LINE,A group of business terms providing information on individual Invoice lines.,,請求書明細行,請求書明細行に関する情報を提供するビジネス用語のグループ。,3760,cac:InvoiceLine,cac:InvoiceLineType,/Invoice/cac:InvoiceLine,1..n
2950,ibt-126,1..1,2,Invoice line identifier,A unique identifier for the individual line within the Invoice.,Identifier,請求書明細行ID,この請求書内で個々の明細行を一意に識別するためのID。,3770,cbc:ID,udt:IdentifierType,/Invoice/cac:InvoiceLine/cbc:ID,1..1
2960,ibt-127,0..1,2,Invoice line note,A textual note that gives unstructured information that is relevant to the Invoice line.,Text,請求書明細行注釈,請求書明細行に関連する構造化されていない情報を提供するためのテキスト、注釈。,3780,cbc:Note,udt:TextType,/Invoice/cac:InvoiceLine/cbc:Note,0..n
2970,ibg-36,0..1,2,LINE DOCUMENT REFERENCE,"An identifier for an object on which the invoice line is based	 given by the Seller.",,明細行文書参照,売り手によって指定された、請求書の明細行の請求の根拠となっているオブジェクトの識別子。,3950,cac:DocumentReference,cac:DocumentReferenceType,/Invoice/cac:InvoiceLine/cac:DocumentReference[not(cbc:DocumentTypeCode='130')],0..n
2980,ibt-188,1..1,3,Invoice line document identifier,An identifiers for a document that the invoice line referes to.,Identifier,明細行文書ID,請求書明細行が参照する文書のID,3960,cbc:ID,udt:IdentifierType,/Invoice/cac:InvoiceLine/cac:DocumentReference[not(cbc:DocumentTypeCode='130')]/cbc:ID,1..1
2990,ibt-189,0..1,3,Document type code,A code that qualifies the type of the document that is referenced.,Code,文書タイプコード,参照する文書の種類を規定するコード,3970,cbc:DocumentTypeCode,udt:CodeType,/Invoice/cac:InvoiceLine/cac:DocumentReference[not(cbc:DocumentTypeCode='130')]/cbc:DocumentTypeCode,0..1
3000,ibt-128,0..1,2,Invoice line object identifier,"An identifier for an object on which the invoice line is based	 given by the Seller.",Identifier,請求書明細行オブジェクトID,売り手によって提供された、請求書明細行の根拠となるオブジェクトのID。(注：必要に応じて、予約番号、電話番号、メーターポイントなどを指定できる。）,3990,cbc:ID,udt:IdentifierType,/Invoice/cac:InvoiceLine/cac:DocumentReference[cbc:DocumentTypeCode='130']/cbc:ID,1..1
3010,ibt-128-1,0..1,3,Invoice line object identifier Scheme identifier,An identifiers for a document that the invoice line referes to.,String,スキーマID,請求書が参照する文書を識別するためのスキーマID。注：受信者にどのスキーマを使用したか明らかにしていない場合は、UNTDID 1153 code list  から選択した、スキーマIDを使用しなければならない。,4000,@schemeID,xsd:normalizedString,/Invoice/cac:InvoiceLine/cac:DocumentReference[cbc:DocumentTypeCode='130']/cbc:ID/@schemeID,0..1
3020,ibt-129,1..1,2,Invoiced quantity,The quantity of items (goods or services) that is charged in the Invoice line.,Quantity,請求する数量,請求書明細行で請求する品目(財又はサービス)の数量。,3790,cbc:InvoicedQuantity,udt:QuantityType,/Invoice/cac:InvoiceLine/cbc:InvoicedQuantity,0..1
3030,ibt-130,1..1,3,Invoiced quantity unit of measure code,The unit of measure that applies to the invoiced quantity.,String,請求する数量の数量単位コード,請求数量に適用する数量単位コード。,3800,@unitCode,xsd:normalizedString,/Invoice/cac:InvoiceLine/cbc:InvoicedQuantity/@unitCode,0..1
3040,ibt-131,1..1,2,Invoice line net amount,The total amount of the Invoice line (before tax).,Amount,値引後請求書明細行金額(税抜き),値引後の請求書明細行の合計金額(税抜き)。,3810,cbc:LineExtensionAmount,udt:AmountType,/Invoice/cac:InvoiceLine/cbc:LineExtensionAmount,1..1
3050,ibt-183,0..1,2,Purchase order reference,"An identifier for a referenced purchase order	 issued by the Buyer.",Document Reference,購買発注書参照,買い手が付番した発注番号を参照するためのID。,3900,cbc:ID,udt:IdentifierType,/Invoice/cac:InvoiceLine/cac:OrderLineReference/cac:OrderReference/cbc:ID,1..1
3060,ibt-132,0..1,2,Referenced purchase order line reference,"An identifier for a referenced line within a purchase order	 issued by the Buyer.",Document Reference,購買発注明細行参照,買い手が付番した発注書内の明細行を参照するためのID。,3880,cbc:LineID,udt:IdentifierType,/Invoice/cac:InvoiceLine/cac:OrderLineReference/cbc:LineID,1..1
3070,ibt-184,0..1,2,Despatch advice reference,An identifier for a referenced despatch advice.,Document Reference,出荷案内書参照,この請求書が参照する出荷案内書を参照するためのID。,3940,cbc:ID,udt:IdentifierType,/Invoice/cac:InvoiceLine/cac:DespatchLineReference/cac:DocumentReference/cbc:ID,1..1
3080,ibt-133,0..1,2,Invoice line Buyer accounting reference,A textual value that specifies where to book the relevant data into the Buyer’s financial accounts.,Text,請求書明細行買い手会計参照,請求書明細行に関連したデータを買い手のどの勘定科目で記帳するかを指定するテキスト。,3830,cbc:AccountingCost,udt:TextType,/Invoice/cac:InvoiceLine/cbc:AccountingCost,0..1
3090,ibg-26,0..1,2,INVOICE LINE PERIOD,A group of business terms providing information about the period relevant for the Invoice line.,,請求書明細行の期間,請求書明細行に関連する期間に関する情報,3840,cac:InvoicePeriod,cac:PeriodType,/Invoice/cac:InvoiceLine/cac:InvoicePeriod,0..n
3100,ibt-134,0..1,3,Invoice line period start date,The date when the Invoice period for this Invoice line starts.,Date,請求書明細行の期間開始日,請求書明細行の請求期間が開始する日付,3850,cbc:StartDate,udt:DateType,/Invoice/cac:InvoiceLine/cac:InvoicePeriod/cbc:StartDate,0..1
3110,ibt-135,0..1,3,Invoice line period end date,The date when the Invoice period for this Invoice line ends.,Date,請求書明細行の期間終了日,請求書明細行の請求期間が終了する日付,3860,cbc:EndDate,udt:DateType,/Invoice/cac:InvoiceLine/cac:InvoicePeriod/cbc:EndDate,0..1
3120,ibg-27,0..n,2,INVOICE LINE ALLOWANCES,A group of business terms providing information about allowances applicable to the individual Invoice line.,,請求書明細行の返金,請求書明細行に適用される返金に関する情報を提供するビジネス用語のグループ。,4010,cac:AllowanceCharge,cac:AllowanceChargeType,/Invoice/cac:InvoiceLine/cac:AllowanceCharge[cbc:ChargeIndicator=false()],0..n
3125,ibt-136a,1..1,3,Syntax qualifier for the invoice line allowance,,Indicator,,,4020,cbc:ChargeIndicator,xsd:boolean,/Invoice/cac:InvoiceLine/cac:AllowanceCharge[cbc:ChargeIndicator=false()]/cbc:ChargeIndicator,1..1
3130,ibt-136,1..1,3,Invoice line allowance amount,"The amount of an allowance	 without TAX.",Amount,請求書明細行の返金金額(税抜き),返金金額(税抜き)。,4060,cbc:Amount,udt:AmountType,/Invoice/cac:InvoiceLine/cac:AllowanceCharge[cbc:ChargeIndicator=false()]/cbc:Amount,1..1
