semSort,id,card,level,businessTerm,desc,dataType,businessTerm_ja,desc_ja,synSort,element,synDatatype,xPath,occur
3140,ibt-137,0..1,3,Invoice line allowance base amount,"The base amount that may be used	 in conjunction with the Invoice line allowance percentage	 to calculate the Invoice line allowance amount.",Amount,請求書明細行の返金金額の基準金額,請求書明細行の返金率を乗じて請求書明細行の返金金額を算出する際に使用される基準金額。,4080,cbc:BaseAmount,udt:AmountType,/Invoice/cac:InvoiceLine/cac:AllowanceCharge[cbc:ChargeIndicator=false()]/cbc:BaseAmount,0..1
3150,ibt-138,0..1,3,Invoice line allowance percentage,"The percentage that may be used	 in conjunction with the Invoice line allowance base amount	 to calculate the Invoice line allowance amount.",Percentage,請求書明細行の返金の率,請求書明細行の返金基準金額を乗じて請求書明細行の返金金額を算出する際に使用されるパーセント。,4050,cbc:MultiplierFactorNumeric,udt:NumericType,/Invoice/cac:InvoiceLine/cac:AllowanceCharge[cbc:ChargeIndicator=false()]/cbc:MultiplierFactorNumeric,0..1
3160,ibt-139,0..1,3,Invoice line allowance reason,"The reason for the Invoice line allowance	 expressed as text.",Text,請求書明細行の返金理由,請求書明細行の返金理由をテキストで表現。,4040,cbc:AllowanceChargeReason,udt:TextType,/Invoice/cac:InvoiceLine/cac:AllowanceCharge[cbc:ChargeIndicator=false()]/cbc:AllowanceChargeReason,0..n
3170,ibt-140,0..1,3,Invoice line allowance reason code,"The reason for the Invoice line allowance	 expressed as a code.",Code,請求書明細行の返金理由コード,請求書明細行の返金理由をコードで表現。,4030,cbc:AllowanceChargeReasonCode,udt:CodeType,/Invoice/cac:InvoiceLine/cac:AllowanceCharge[cbc:ChargeIndicator=false()]/cbc:AllowanceChargeReasonCode,0..1
3180,ibg-28,0..n,2,INVOICE LINE CHARGES,A group of business terms providing information about charges and taxes other than TAX applicable to the individual Invoice line.,,請求書明細行の追加請求,請求書明細行に適用される追加請求に関する情報を提供するビジネス用語のグループ。,4100,cac:AllowanceCharge,cac:AllowanceChargeType,/Invoice/cac:InvoiceLine/cac:AllowanceCharge[cbc:ChargeIndicator=true()],0..n
3185,ibt-141a,1..1,3,Syntax qualifier for the invoice line allowance,,Indicator,,,4110,cbc:ChargeIndicator,xsd:boolean,/Invoice/cac:InvoiceLine/cac:AllowanceCharge[cbc:ChargeIndicator=true()]/cbc:ChargeIndicator,1..1
3190,ibt-141,1..1,3,Invoice line charge amount,"The amount of a charge	 without TAX.",Amount,請求書明細行の追加請求金額(税抜き),追加請求金額(税抜き)。,4150,cbc:Amount,udt:AmountType,/Invoice/cac:InvoiceLine/cac:AllowanceCharge[cbc:ChargeIndicator=true()]/cbc:Amount,1..1
3200,ibt-142,0..1,3,Invoice line charge base amount,"The base amount that may be used	 in conjunction with the Invoice line charge percentage	 to calculate the Invoice line charge amount.",Amount,請求書明細行の追加請求の基準金額,請求書明細行の追加請求金額を計算するために、請求書明細行の追加請求率が適用される基準金額。,4170,cbc:BaseAmount,udt:AmountType,/Invoice/cac:InvoiceLine/cac:AllowanceCharge[cbc:ChargeIndicator=true()]/cbc:BaseAmount,0..1
3210,ibt-143,0..1,3,Invoice line charge percentage,"The percentage that may be used	 in conjunction with the Invoice line charge base amount	 to calculate the Invoice line charge amount.",Percentage,請求書明細行の追加請求の率,請求書明細行の追加請求基準金額に対して請求書明細行の追加請求金額の計算に使用するパーセント。,4140,cbc:MultiplierFactorNumeric,udt:NumericType,/Invoice/cac:InvoiceLine/cac:AllowanceCharge[cbc:ChargeIndicator=true()]/cbc:MultiplierFactorNumeric,0..1
3220,ibt-144,0..1,3,Invoice line charge reason,"The reason for the Invoice line charge	 expressed as text.",Text,請求書明細行の追加請求理由,請求書明細行の追加請求理由をテキストで表現。,4130,cbc:AllowanceChargeReason,udt:TextType,/Invoice/cac:InvoiceLine/cac:AllowanceCharge[cbc:ChargeIndicator=true()]/cbc:AllowanceChargeReason,0..n
3230,ibt-145,0..1,3,Invoice line charge reason code,"The reason for the Invoice line charge	 expressed as a code.",Code,請求書明細行の追加請求理由コード,請求書明細行の追加請求理由をコードで表現。,4120,cbc:AllowanceChargeReasonCode,udt:CodeType,/Invoice/cac:InvoiceLine/cac:AllowanceCharge[cbc:ChargeIndicator=true()]/cbc:AllowanceChargeReasonCode,0..1
3240,ibg-29,1..1,2,PRICE DETAILS,A group of business terms providing information about the price applied for the goods and services invoiced on the Invoice line.,,取引価格詳細,請求書明細行で請求する財又はサービスに適用される価格に係る情報を提供するビジネス用語のグループ。,4460,cac:Price,cac:PriceType,/Invoice/cac:InvoiceLine/cac:Price,0..1
3250,ibt-146,1..1,3,Item net price,"The price of an item	 exclusive of TAX	 after subtracting item price discount.",Unit Price Amount,品目単価(値引後)(税抜き),値引金額を差し引いた後の、消費税を除く品目単価。,4470,cbc:PriceAmount,udt:AmountType,/Invoice/cac:InvoiceLine/cac:Price/cbc:PriceAmount,1..1
3255,ibt-147b,1..1,3,Syntax qualifier for the price discount,,Indicator,,,4525,cbc:ChargeIndicator,xsd:boolean,/Invoice/cac:InvoiceLine/cac:Price/cac:AllowanceCharge[cbc:ChargeIndicator=false()]/cbc:ChargeIndicator,1..1
3260,ibt-147,0..1,3,Item price discount,The total discount subtracted from the Item gross price to calculate the Item net price.,Unit Price Amount,品目単価値引(税抜き),品目単価(値引後)(税抜き)を計算するために、品目単価(値引前)(税抜き)から差し引かれる値引。,4530,cbc:Amount,udt:AmountType,/Invoice/cac:InvoiceLine/cac:Price/cac:AllowanceCharge[cbc:ChargeIndicator=false()]/cbc:Amount,1..1
3270,ibt-148,0..1,3,Item gross price,"The unit price	 exclusive of TAX	 before subtracting Item price discount.",Unit Price Amount,品目単価(値引前)(税抜き),値引(税抜き)を差し引く前の、品目単価(税抜き)。,4550,cbc:BaseAmount,udt:AmountType,/Invoice/cac:InvoiceLine/cac:Price/cac:AllowanceCharge[cbc:ChargeIndicator=false()]/cbc:BaseAmount,0..1
3280,ibt-149,0..1,3,Item price base quantity,The number of item units to which the price applies.,Quantity,品目単価基準数量,単価が適用される品目の数量単位での基準数。,4490,cbc:BaseQuantity,udt:QuantityType,/Invoice/cac:InvoiceLine/cac:Price/cbc:BaseQuantity,0..1
3290,ibt-150,0..1,4,Item price base quantity unit of measure code,The unit of measure that applies to the Item price base quantity.,String,品目単価基準数量の数量単位コード,品目単価基準数量に適用される数量単位。,4500,@unitCode,xsd:normalizedString,/Invoice/cac:InvoiceLine/cac:Price/cbc:BaseQuantity/@unitCode,0..1
3300,ibg-30,1..n,2,LINE TAX INFORMATION,A group of business terms providing information about the TAX applicable for the goods and services invoiced on the Invoice line.,,請求書明細行税情報,請求書明細行で請求する財又はサービスに適用される消費税に係る情報を提供するビジネス用語のグループ。,4350,cac:ClassifiedTaxCategory,cac:TaxCategoryType,/Invoice/cac:InvoiceLine/cac:Item/cac:ClassifiedTaxCategory,0..n
3310,ibt-151,1..1,3,Invoiced item TAX category code,The TAX category code for the invoiced item.,Code,請求する品目に対する課税分類コード,請求する品目に対して適用される課税分類コード。,4360,cbc:ID,udt:IdentifierType,/Invoice/cac:InvoiceLine/cac:Item/cac:ClassifiedTaxCategory/cbc:ID,0..1
3320,ibt-152,0..1,3,Invoiced item TAX rate,"The TAX rate	 represented as percentage that applies to the invoiced item.",Percentage,請求する品目に対する税率,請求する品目に対して適用される税率で、パーセントで表現。,4370,cbc:Percent,udt:PercentType,/Invoice/cac:InvoiceLine/cac:Item/cac:ClassifiedTaxCategory/cbc:Percent,0..1
3330,ibt-166,0..1,3,Unit TAX (amount),A TAX amount that applied to each item unit.,Amount,請求する品目に対する単位数量当たりの税金額,請求する品目の単位数量に対して適用される税金額で、パーセントでなく金額で表現。,4380,cbc:PerUnitAmount,udt:AmountType,/Invoice/cac:InvoiceLine/cac:Item/cac:ClassifiedTaxCategory/cbc:PerUnitAmount,0..1
3340,ibt-185,0..0,3,TAX exemption reason text,A textual statement of the reason why the line amount is exempted from TAX or why no TAX is being charged,Code,非課税理由テキスト,非課税または課税されない理由をコードで表現。,4390,cbc:TaxExemptionReasonCode,udt:CodeType,/Invoice/cac:InvoiceLine/cac:Item/cac:ClassifiedTaxCategory/cbc:TaxExemptionReasonCode,0..1
3350,ibt-186,0..0,3,TAX exemption reason code,A coded statement of the reason for why the line amount is exempted from TAX.,Text,非課税理由コード,非課税または課税されない理由をテキストで表現。,4400,cbc:TaxExemptionReason,udt:TextType,/Invoice/cac:InvoiceLine/cac:Item/cac:ClassifiedTaxCategory/cbc:TaxExemptionReason,0..n
3360,ibt-167,0..1,3,Tax Scheme,A code indicating the type of tax,Code,税スキーマ,税の種類を示すコード。,4420,cbc:ID,udt:IdentifierType,/Invoice/cac:InvoiceLine/cac:Item/cac:ClassifiedTaxCategory/cac:TaxScheme/cbc:ID,0..1
3370,ibg-31,1..1,2,ITEM INFORMATION,A group of business terms providing information about the goods and services invoiced.,,品目情報,請求する財又はサービスに係る情報を提供するビジネス用語のグループ。,4190,cac:Item,cac:ItemType,/Invoice/cac:InvoiceLine/cac:Item,1..1
3380,ibt-153,1..1,3,Item name,A name for an item.,Text,品名,取引品目の品名。,4210,cbc:Name,udt:NameType,/Invoice/cac:InvoiceLine/cac:Item/cbc:Name,0..1
3390,ibt-154,0..1,3,Item description,A description for an item.,Text,品目摘要,取引品目を説明した文章。,4200,cbc:Description,udt:TextType,/Invoice/cac:InvoiceLine/cac:Item/cbc:Description,0..n
3400,ibt-155,0..1,3,Item Seller's identifier,"An identifier	 assigned by the Seller	 for the item.",Identifier,売り手による品目ID,売り手が取引品目に割当てたID,4250,cbc:ID,udt:IdentifierType,/Invoice/cac:InvoiceLine/cac:Item/cac:SellersItemIdentification/cbc:ID,1..1
3410,ibt-156,0..1,3,Item Buyer's identifier,"An identifier	 assigned by the Buyer	 for the item.",Identifier,買い手による品目ID,買い手が取引品目に割当てたID,4230,cbc:ID,udt:IdentifierType,/Invoice/cac:InvoiceLine/cac:Item/cac:BuyersItemIdentification/cbc:ID,1..1
3420,ibt-157,0..1,3,Item standard identifier,An item identifier based on a registered scheme.,Identifier,品目標準ID,登録されているスキーマに基づいた品目ID。,4270,cbc:ID,udt:IdentifierType,/Invoice/cac:InvoiceLine/cac:Item/cac:StandardItemIdentification/cbc:ID,1..1
3430,ibt-157-1,1..1,4,Item standard identifier Scheme identifier,The identification scheme shall be identified from the entries of the list published by the ISO/IEC 6523 maintenance agency.,String,スキーマID,使用する場合、識別スキーマは、ISO/IEC 6523 保守機関が公開しているリストから選択しなければならない。,4280,@schemeID,xsd:normalizedString,/Invoice/cac:InvoiceLine/cac:Item/cac:StandardItemIdentification/cbc:ID/@schemeID,0..1
3440,ibt-158,0..n,3,Item classification identifier,A code for classifying the item by its type or nature.,Identifier,品目分類ID,種類や性質によって品目を分類するコード。,4320,cbc:ItemClassificationCode,udt:CodeType,/Invoice/cac:InvoiceLine/cac:Item/cac:CommodityClassification/cbc:ItemClassificationCode,0..1
3450,ibt-158-1,1..1,4,Item classification identifier Scheme identifier,The identification scheme shall be chosen from the entries in UNTDID 7143 [6].,String,スキーマID,品目分類IDの識別スキーマIDは、UNTDID 7143にある項目から選択すること。,4330,@listID,xsd:normalizedString,/Invoice/cac:InvoiceLine/cac:Item/cac:CommodityClassification/cbc:ItemClassificationCode/@listID,0..1
3460,ibt-158-2,0..1,4,Item classification identifier Scheme version identifier,The version of the identification scheme.,String,スキーマのバージョンID,スキーマのバージョン。,4340,@listVersionID,xsd:normalizedString,/Invoice/cac:InvoiceLine/cac:Item/cac:CommodityClassification/cbc:ItemClassificationCode/@listVersionID,0..1
3470,ibt-159,0..1,3,Item country of origin,The code identifying the country from which the item originates.,Code,品目の原産国,品目の原産国を識別するコード。,4300,cbc:IdentificationCode,udt:CodeType,/Invoice/cac:InvoiceLine/cac:Item/cac:OriginCountry/cbc:IdentificationCode,0..1
3480,ibg-32,0..n,3,ITEM ATTRIBUTES,A group of business terms providing information about properties of the goods and services invoiced.,,品目属性,品目およびサービスのプロパティに関する情報を提供するビジネス用語のグループ。,4430,cac:AdditionalItemProperty,cac:ItemPropertyType,/Invoice/cac:InvoiceLine/cac:Item/cac:AdditionalItemProperty,0..n
3490,ibt-160,1..1,4,Item attribute name,The name of the attribute or property of the item.,Text,品目属性名,品目の属性またはプロパティの名称。,4440,cbc:Name,udt:NameType,/Invoice/cac:InvoiceLine/cac:Item/cac:AdditionalItemProperty/cbc:Name,1..1
3500,ibt-161,1..1,4,Item attribute value,The value of the attribute or property of the item.,Text,品目属性値,品目の属性またはプロパティの値。,4450,cbc:Value,udt:TextType,/Invoice/cac:InvoiceLine/cac:Item/cac:AdditionalItemProperty/cbc:Value,0..1
