semSort,id,card,level,businessTerm,desc,dataType,businessTerm_ja,desc_ja,synSort,element,synDatatype,xPath,occur
1730,ibt-053,0..1,3,Buyer post code,The identifier for an addressable group of properties according to the relevant postal service.,Text,買い手郵便番号,買い手の住所の郵便番号。,1990,cbc:PostalZone,udt:TextType,/Invoice/cac:AccountingCustomerParty/cac:Party/cac:PostalAddress/cbc:PostalZone,0..1
1740,ibt-054,0..1,3,Buyer country subdivision,The subdivision of a country.,Text,買い手住所 都道府県,買い手の住所の地方区分。,2000,cbc:CountrySubentity,udt:TextType,/Invoice/cac:AccountingCustomerParty/cac:Party/cac:PostalAddress/cbc:CountrySubentity,0..1
1750,ibt-055,1..1,3,Buyer country code,A code that identifies the country.,Code,買い手国コード,買い手の住所の国コード。,2040,cbc:IdentificationCode,udt:CodeType,/Invoice/cac:AccountingCustomerParty/cac:Party/cac:PostalAddress/cac:Country/cbc:IdentificationCode,0..1
1760,ibg-09,0..1,2,BUYER CONTACT,A group of business terms providing contact information relevant for the Buyer.,,買い手連絡先,買い手の連絡先に係る情報を提供するビジネス用語のグループ。,2140,cac:Contact,cac:ContactType,/Invoice/cac:AccountingCustomerParty/cac:Party/cac:Contact,0..1
1770,ibt-056,0..1,3,Buyer contact point,A contact point for a legal entity or person.,Text,買い手連絡先,買い手の法人や個人の連絡先。,2150,cbc:Name,udt:NameType,/Invoice/cac:AccountingCustomerParty/cac:Party/cac:Contact/cbc:Name,0..1
1780,ibt-057,0..1,3,Buyer contact telephone number,A phone number for the contact point.,Text,買い手連絡先電話番号,買い手の連絡先電話番号。,2160,cbc:Telephone,udt:TextType,/Invoice/cac:AccountingCustomerParty/cac:Party/cac:Contact/cbc:Telephone,0..1
1790,ibt-058,0..1,3,Buyer contact email address,An e-mail address for the contact point.,Text,買い手連絡先電子メールアドレス,買い手の連絡先電子メールアドレス。,2170,cbc:ElectronicMail,udt:TextType,/Invoice/cac:AccountingCustomerParty/cac:Party/cac:Contact/cbc:ElectronicMail,0..1
1800,ibg-10,0..1,1,PAYEE,"A group of business terms providing information about the Payee	 i.e. the role that receives the payment.",,支払先,支払先に係る情報を提供するビジネス用語のグループ。,2180,cac:PayeeParty,cac:PartyType,/Invoice/cac:PayeeParty,0..1
1810,ibt-059,1..1,2,Payee name,The name of the Payee.,Text,支払先名称,支払先の名称。,2230,cbc:Name,udt:NameType,/Invoice/cac:PayeeParty/cac:PartyName/cbc:Name,1..1
1820,ibt-060,0..1,2,Payee identifier,An identifier for the Payee.,Identifier,支払先ID,支払先のID。,2200,cbc:ID,udt:IdentifierType,/Invoice/cac:PayeeParty/cac:PartyIdentification/cbc:ID,1..1
1830,ibt-060-1,0..1,3,Payee identifier Scheme identifier,"If used	 the identification scheme shall be chosen from the entries of the list published by the ISO/IEC 6523 maintenance agency.",String,スキーマID,使用する場合、識別スキーマは、ISO/ IEC 6523 保守機関として公開されたリストから選択しなければならない。,2210,@schemeID,xsd:normalizedString,/Invoice/cac:PayeeParty/cac:PartyIdentification/cbc:ID/@schemeID,0..1
1840,ibt-061,0..1,2,Payee legal registration identifier,An identifier issued by an official registrar that identifies the Payee as a legal entity or person.,Identifier,支払先登録企業ID,公的登録機関が発行した公的識別子としての支払先の国際企業ID。,2250,cbc:CompanyID,udt:IdentifierType,/Invoice/cac:PayeeParty/cac:PartyLegalEntity/cbc:CompanyID,0..1
1850,ibt-061-1,0..1,3,Payee legal registration identifier Scheme identifier,"If used	 the identification scheme shall be chosen from the entries of the list published by the ISO/IEC 6523 maintenance agency.",String,スキーマID,使用する場合、公的機登録機関の識別スキーマは、ISO/IEC6523保守機関として公開されているリストから選択しなければならない。,2260,@schemeID,xsd:normalizedString,/Invoice/cac:PayeeParty/cac:PartyLegalEntity/cbc:CompanyID/@schemeID,0..1
1860,ibg-11,0..1,1,SELLER TAX REPRESENTATIVE PARTY,A group of business terms providing information about the Seller’s tax representative.,,売り手税務代理人,売り手の税務代理人に係る情報を提供するビジネス用語のグループ。,2270,cac:TaxRepresentativeParty,cac:PartyType,/Invoice/cac:TaxRepresentativeParty,0..1
1870,ibt-062,1..1,2,Seller tax representative name,The full name of the Seller’s tax representative party.,Text,売り手税務代理人名称,売り手の税務代理人の名称。,2290,cbc:Name,udt:NameType,/Invoice/cac:TaxRepresentativeParty/cac:PartyName/cbc:Name,1..1
1880,ibt-063,1..1,2,Seller tax representative TAX identifier,The TAX identifier of the Seller’s tax representative party.,Identifier,売り手税務代理人税ID,売り手の税務代理人の税ID。,2410,cbc:CompanyID,udt:IdentifierType,/Invoice/cac:TaxRepresentativeParty/cac:PartyTaxScheme/cbc:CompanyID,0..1
1885,ibt-063-1,1..1,2,Qualifier for the seller tax representative TAX identifier,,Identifier,,,2420,cbc:ID,udt:IdentifierType,/Invoice/cac:TaxRepresentativeParty/cac:PartyTaxScheme/cac:TaxScheme/cbc:ID,0..1
1890,ibg-12,1..1,2,SELLER TAX REPRESENTATIVE POSTAL ADDRESS,A group of business terms providing information about the postal address for the tax representative party.,,売り手税務代理人住所,税務代理人の住所に関する情報を提供するビジネス用語のグループ。,2300,cac:PostalAddress,cac:AddressType,/Invoice/cac:TaxRepresentativeParty/cac:PostalAddress,0..1
1900,ibt-064,0..1,3,Tax representative address line 1,The main address line in an address.,Text,税務代理人住所欄1,税務代理人の住所の主な記載欄。,2310,cbc:StreetName,udt:NameType,/Invoice/cac:TaxRepresentativeParty/cac:PostalAddress/cbc:StreetName,0..1
1910,ibt-065,0..1,3,Tax representative address line 2,An additional address line in an address that can be used to give further details supplementing the main line.,Text,税務代理人住所欄2,税務代理人の住所の主な記載内容に加えて詳細な情報のために使用する追加記載欄。,2320,cbc:AdditionalStreetName,udt:NameType,/Invoice/cac:TaxRepresentativeParty/cac:PostalAddress/cbc:AdditionalStreetName,0..1
1920,ibt-164,0..1,3,Tax representative address line 3,An additional address line in an address that can be used to give further details supplementing the main line.,Text,税務代理人住所欄3,税務代理人の住所の上記の記載内容に加えてより詳細な情報のために使用する追加記載欄。,2370,cbc:Line,udt:TextType,/Invoice/cac:TaxRepresentativeParty/cac:PostalAddress/cac:AddressLine/cbc:Line,1..1
1930,ibt-066,0..1,3,Tax representative city,"The common name of the city	 town or village	 where the tax representative address is located.",Text,税務代理人住所 市区町村,税務代理人が所在する市、町、村の通称。,2330,cbc:CityName,udt:NameType,/Invoice/cac:TaxRepresentativeParty/cac:PostalAddress/cbc:CityName,0..1
1940,ibt-067,0..1,3,Tax representative post code,The identifier for an addressable group of properties according to the relevant postal service.,Text,税務代理人郵便番号,税務代理人の住所の郵便番号。,2340,cbc:PostalZone,udt:TextType,/Invoice/cac:TaxRepresentativeParty/cac:PostalAddress/cbc:PostalZone,0..1
1950,ibt-068,0..1,3,Tax representative country subdivision,The subdivision of a country.,Text,税務代理人住所 都道府県,税務代理人の住所の地方区分。,2350,cbc:CountrySubentity,udt:TextType,/Invoice/cac:TaxRepresentativeParty/cac:PostalAddress/cbc:CountrySubentity,0..1
1960,ibt-069,1..1,3,Tax representative country code,A code that identifies the country.,Code,税務代理人国コード,税務代理人の住所の国コード。,2390,cbc:IdentificationCode,udt:CodeType,/Invoice/cac:TaxRepresentativeParty/cac:PostalAddress/cac:Country/cbc:IdentificationCode,0..1
1970,ibg-13,0..1,1,DELIVERY INFORMATION,A group of business terms providing information about where and when the goods and services invoiced are delivered.,,納入先,財又はサービスが何時何処に納入されたかに係る情報を提供するビジネス用語のグループ。,2440,cac:Delivery,cac:DeliveryType,/Invoice/cac:Delivery,0..n
1980,ibt-070,0..1,2,Deliver to party name,The name of the party to which the goods and services are delivered.,Text,納入先名称,財又はサービスが納入された納入先の名称。,2610,cbc:Name,udt:NameType,/Invoice/cac:Delivery/cac:DeliveryParty/cac:PartyName/cbc:Name,1..1
1990,ibt-071,0..1,2,Deliver to location identifier,An identifier for the location at which the goods and services are delivered.,Identifier,納入先ID,財又はサービスが納入された納入先の場所ID。,2470,cbc:ID,udt:IdentifierType,/Invoice/cac:Delivery/cac:DeliveryLocation/cbc:ID,0..1
2000,ibt-071-1,0..1,3,Deliver to location identifier Scheme identifier,"The identification scheme identifier of the Deliver to location identifier. If used	 the identification scheme shall be chosen from the entries of the list published by the ISO/IEC 6523 maintenance agency.",String,スキーマID,納入された住所IDを発行した組織の識別スキーマID。使用する場合、識別スキーマは、ISO/IEC 6523 の保守機関によって公開されたリストから選択しなければならない。,2480,@schemeID,xsd:normalizedString,/Invoice/cac:Delivery/cac:DeliveryLocation/cbc:ID/@schemeID,0..1
2010,ibt-072,0..1,2,Actual delivery date,the date on which the supply of goods or services was made or completed.,Date,実際納入日,財又はサービスが納入された、あるいはすべて提供された日付。,2450,cbc:ActualDeliveryDate,udt:DateType,/Invoice/cac:Delivery/cbc:ActualDeliveryDate,0..1
2020,ibg-14,0..1,2,INVOICING PERIOD,A group of business terms providing information on the invoice period.,,請求期間,請求期間に関わる情報を提供するビジネス用語のグループ。,1140,cac:InvoicePeriod,cac:PeriodType,/Invoice/cac:InvoicePeriod,0..n
2030,ibt-073,0..1,3,Invoicing period start date,The date when the Invoice period starts.,Date,請求期間開始日,請求期間開始日。,1150,cbc:StartDate,udt:DateType,/Invoice/cac:InvoicePeriod/cbc:StartDate,0..1
2040,ibt-074,0..1,3,Invoicing period end date,The date when the Invoice period ends.,Date,請求期間終了日,請求期間終了日。,1160,cbc:EndDate,udt:DateType,/Invoice/cac:InvoicePeriod/cbc:EndDate,0..1
2050,ibg-15,0..1,2,DELIVER TO ADDRESS,A group of business terms providing information about the address to which goods and services invoiced were or are delivered.,,納入先住所,請求する財又はサービスの納入先の住所に関する情報を提供するビジネス用語のグループ。,2490,cac:Address,cac:AddressType,/Invoice/cac:Delivery/cac:DeliveryLocation/cac:Address,0..1
2060,ibt-075,0..1,3,Deliver to address line 1,The main address line in an address.,Text,納入先住所欄1,納入先の住所の主な記載欄。,2500,cbc:StreetName,udt:NameType,/Invoice/cac:Delivery/cac:DeliveryLocation/cac:Address/cbc:StreetName,0..1
2070,ibt-076,0..1,3,Deliver to address line 2,An additional address line in an address that can be used to give further details supplementing the main line.,Text,納入先住所欄2,納入先の住所の主な記載内容に加えて詳細な情報のために使用する追加記載欄。,2510,cbc:AdditionalStreetName,udt:NameType,/Invoice/cac:Delivery/cac:DeliveryLocation/cac:Address/cbc:AdditionalStreetName,0..1
2080,ibt-165,0..1,3,Deliver to address line 3,An additional address line in an address that can be used to give further details supplementing the main line.,Text,納入先住所欄3,納入先の住所の上記の記載内容に加えてより詳細な情報のために使用する追加記載欄。,2560,cbc:Line,udt:TextType,/Invoice/cac:Delivery/cac:DeliveryLocation/cac:Address/cac:AddressLine/cbc:Line,1..1
2090,ibt-077,0..1,3,Deliver to city,"The common name of the city	 town or village	 where the deliver to address is located.",Text,納入先住所 市区町村,納入先が所在する市、町、村の通称。,2520,cbc:CityName,udt:NameType,/Invoice/cac:Delivery/cac:DeliveryLocation/cac:Address/cbc:CityName,0..1
2100,ibt-078,0..1,3,Deliver to post code,The identifier for an addressable group of properties according to the relevant postal service.,Text,納入先郵便番号,納入先の住所の郵便番号。,2530,cbc:PostalZone,udt:TextType,/Invoice/cac:Delivery/cac:DeliveryLocation/cac:Address/cbc:PostalZone,0..1
2110,ibt-079,0..1,3,Deliver to country subdivision,The subdivision of a country.,Text,納入先住所 都道府県,納入先の住所の地方区分。,2540,cbc:CountrySubentity,udt:TextType,/Invoice/cac:Delivery/cac:DeliveryLocation/cac:Address/cbc:CountrySubentity,0..1
2120,ibt-080,1..1,3,Deliver to country code,A code that identifies the country.,Code,納入先国コード,納入先の住所の国コード。,2580,cbc:IdentificationCode,udt:CodeType,/Invoice/cac:Delivery/cac:DeliveryLocation/cac:Address/cac:Country/cbc:IdentificationCode,0..1
2130,ibg-16,0..n,1,PAYMENT INSTRUCTIONS,A group of business terms providing information about the payment.,,支払指示,取引条件のうち支払に関する情報を提供するビジネス用語のグループ。,2620,cac:PaymentMeans,cac:PaymentMeansType,/Invoice/cac:PaymentMeans,0..n
2140,ibt-178,0..1,2,Payment Instructions ID,An identifier for the payment instructions.,Identifier,支払指示ID,各支払指示に対して割り当てられるID。,2630,cbc:ID,udt:IdentifierType,/Invoice/cac:PaymentMeans/cbc:ID,0..1
2150,ibt-081,1..1,2,Payment means type code,"The means	 expressed as code	 for how a payment is expected to be or has been settled.",Code,支払手段タイプコード,取引決済手段のタイプを識別するコード。,2640,cbc:PaymentMeansCode,udt:CodeType,/Invoice/cac:PaymentMeans/cbc:PaymentMeansCode,1..1
2160,ibt-082,0..1,3,Payment means text,A textual description of the means/methods by which the payment is expected to be or has been settled.,String,支払手段内容説明,取引決済手段を説明するテキスト。,2650,@name,xsd:string,/Invoice/cac:PaymentMeans/cbc:PaymentMeansCode/@name,0..1
2170,ibt-083,0..n,2,Remittance information,A textual value used for payment routing or to establish a link between the payment and the Invoice.,Text,送金情報,支払と請求書とを紐づけるために使用されるテキスト。,2660,cbc:PaymentID,udt:IdentifierType,/Invoice/cac:PaymentMeans/cbc:PaymentID,0..n
2180,ibt-083-1,0..1,3,Remittance information Scheme identifier,The identification of the identification scheme. As example ABA,String,スキーマID,スキーマID、例えば、ABA。,2670,@schemeID,xsd:normalizedString,/Invoice/cac:PaymentMeans/cbc:PaymentID/@schemeID,0..1
2190,ibg-17,0..1,2,CREDIT TRANSFER,A group of business terms to specify credit transfer payments.,,銀行振込,銀行振込による支払を指定する情報を提供するビジネス用語のグループ。,2720,cac:PayeeFinancialAccount,cac:FinancialAccountType,/Invoice/cac:PaymentMeans/cac:PayeeFinancialAccount,0..1
2200,ibt-084,1..1,3,Payment account identifier,"A unique identifier of the financial payment account	 at a payment service provider	 to which payment should be made.",Identifier,支払先口座ID,支払先となる金融機関の口座ID。IBAN(SEPA支払いの場合)など。,2730,cbc:ID,udt:IdentifierType,/Invoice/cac:PaymentMeans/cac:PayeeFinancialAccount/cbc:ID,0..1
2210,ibt-084-1,0..1,4,Payment account identifier Scheme identifier,The identification of the identification scheme. As example IBAN,String,スキーマID,口座IDを発行する発番組織のスキーマID、例えば、IBAN。,2740,@schemeID,xsd:normalizedString,/Invoice/cac:PaymentMeans/cac:PayeeFinancialAccount/cbc:ID/@schemeID,0..1
2220,ibt-085,0..1,3,Payment account name,"The name of the payment account	 at a payment service provider	 to which payment should be made.",Text,支払先口座名義人名,支払先口座の口座名義人名。,2750,cbc:Name,udt:NameType,/Invoice/cac:PaymentMeans/cac:PayeeFinancialAccount/cbc:Name,0..1
2230,ibt-086,0..1,3,Payment service provider identifier,An identifier for the payment service provider where a payment account is located.,Identifier,支払先金融機関ID,支払先口座がある金融機関ID。,2770,cbc:ID,udt:IdentifierType,/Invoice/cac:PaymentMeans/cac:PayeeFinancialAccount/cac:FinancialInstitutionBranch/cbc:ID,0..1
2240,ibg-34,0..1,2,FINANCIAL INSTITUTION ADDRESS,The address of the financial institution or its branch that holds the payment account.,,住所,支払い先口座がある金融機関やその支店の住所を提供するビジネス用語のグループ。,2780,cac:Address,cac:AddressType,/Invoice/cac:PaymentMeans/cac:PayeeFinancialAccount/cac:FinancialInstitutionBranch/cac:Address,0..1
2250,ibt-169,0..1,3,Account address line 1,The main address line in an address.,Text,支払先口座住所欄1,税務代理人の住所の主な記載欄。,2790,cbc:StreetName,udt:NameType,/Invoice/cac:PaymentMeans/cac:PayeeFinancialAccount/cac:FinancialInstitutionBranch/cac:Address/cbc:StreetName,0..1
2260,ibt-170,0..1,3,Account address line 2,An additional address line in an address that can be used to give further details supplementing the main line.,Text,支払先口座住所欄2,税務代理人の住所の主な記載内容に加えて詳細な情報のために使用する追加記載欄。,2800,cbc:AdditionalStreetName,udt:NameType,/Invoice/cac:PaymentMeans/cac:PayeeFinancialAccount/cac:FinancialInstitutionBranch/cac:Address/cbc:AdditionalStreetName,0..1
2270,ibt-171,0..1,3,Account city,"The common name of the city	 town or village	 where the account address is located.",Text,支払先口座住所 市区町村,税務代理人の住所の上記の記載内容に加えてより詳細な情報のために使用する追加記載欄。,2810,cbc:CityName,udt:NameType,/Invoice/cac:PaymentMeans/cac:PayeeFinancialAccount/cac:FinancialInstitutionBranch/cac:Address/cbc:CityName,0..1
2280,ibt-172,0..1,3,Account post code,The identifier for an addressable group of properties according to the relevant postal service.,Text,支払先口座郵便番号,税務代理人が所在する市、町、村の通称。,2820,cbc:PostalZone,udt:TextType,/Invoice/cac:PaymentMeans/cac:PayeeFinancialAccount/cac:FinancialInstitutionBranch/cac:Address/cbc:PostalZone,0..1
2290,ibt-173,0..1,3,Account country subdivision,The subdivision of a country.,Text,支払先口座住所 都道府県,税務代理人の住所の郵便番号。,2830,cbc:CountrySubentity,udt:TextType,/Invoice/cac:PaymentMeans/cac:PayeeFinancialAccount/cac:FinancialInstitutionBranch/cac:Address/cbc:CountrySubentity,0..1
2300,ibt-174,0..1,3,Account address line 3,An additional address line in an address that can be used to give further details supplementing the main line.,Text,支払先口座住所欄3,税務代理人の住所の地方区分。,2850,cbc:Line,xsd:string,/Invoice/cac:PaymentMeans/cac:PayeeFinancialAccount/cac:FinancialInstitutionBranch/cac:Address/cac:AddressLine/cbc:Line,1..1
2310,ibt-175,0..1,3,Account country code,A code that identifies the country.,Code,支払先口座国コード,税務代理人の住所の国コード。,2870,cbc:IdentificationCode,udt:CodeType,/Invoice/cac:PaymentMeans/cac:PayeeFinancialAccount/cac:FinancialInstitutionBranch/cac:Address/cac:Country/cbc:IdentificationCode,0..1
2320,ibg-18,0..1,2,PAYMENT CARD INFORMATION,A group of business terms providing information about card used for payment contemporaneous with invoice issuance.,,支払カード情報,請求書発行と同時に支払に使用されるカードに関する情報を提供するビジネス用語のグループ。,2680,cac:CardAccount,cac:CardAccountType,/Invoice/cac:PaymentMeans/cac:CardAccount,0..1
2330,ibt-087,1..1,3,Payment card primary account number,The Primary Account Number (PAN) of the card used for payment.,Text,支払カード番号,支払に使用するカードの支払カード番号。,2690,cbc:PrimaryAccountNumberID,udt:IdentifierType,/Invoice/cac:PaymentMeans/cac:CardAccount/cbc:PrimaryAccountNumberID,1..1
2335,ibt-088a,0..1,3,Payment card issuer name,The name of the payment card issuer.,Text,カード発行会社,支払カード発行会社の名称。,2700,cbc:NetworkID,xsd:normalizedString,/Invoice/cac:PaymentMeans/cac:CardAccount/cbc:NetworkID,0..1
2340,ibt-088,0..1,3,Payment card holder name,The name of the payment card holder.,Text,カード名義人氏名,支払カード所有者の氏名。,2710,cbc:HolderName,udt:NameType,/Invoice/cac:PaymentMeans/cac:CardAccount/cbc:HolderName,0..1
2350,ibg-19,0..1,2,DIRECT DEBIT,A group of business terms to specify a direct debit.,,自動口座引落,口座引落しを指定するビジネス条件の情報を提供するビジネス用語のグループ。,2880,cac:PaymentMandate,cac:PaymentManudt:DateType,/Invoice/cac:PaymentMeans/cac:PaymentMandate,0..1
2360,ibt-089,0..1,3,Mandate reference identifier,Unique identifier assigned by the Payee for referencing the direct debit mandate.,Identifier,マンデーション参照ID,口座振替依頼を参照するために受取人によって割り当てられた固有ID。,2890,cbc:ID,udt:IdentifierType,/Invoice/cac:PaymentMeans/cac:PaymentMandate/cbc:ID,0..1
2370,ibt-091,0..1,3,Debited account identifier,The account to be debited by the direct debit.,Identifier,自動引落口座ID,自動口座引落によって引き落としがされる銀行口座ID。,2910,cbc:ID,udt:IdentifierType,/Invoice/cac:PaymentMeans/cac:PaymentMandate/cac:PayerFinancialAccount/cbc:ID,0..1
2380,ibg-35,0..n,1,Paid amounts,Breakdown of the paid amount deducted from the amount due.,,支払済金額,請求書通貨での支払済金額を提供するビジネス用語のグループ。,2970,cac:PrepaidPayment,cac:PaymentType,/Invoice/cac:PrepaidPayment,0..n
2390,ibt-179,0..1,2,Payment identifier,"An identifier that references the payment	 such as bank transfer identifier.",Identifier,支払ID,銀行振込のIDなど、支払を参照するID,2980,cbc:ID,udt:IdentifierType,/Invoice/cac:PrepaidPayment/cbc:ID,0..1
2400,ibt-180,1..1,2,Paid amount,The amount of the payment in the invoice currency.,Amount,支払済金額,請求書通貨での支払済金額。,2990,cbc:PaidAmount,udt:AmountType,/Invoice/cac:PrepaidPayment/cbc:PaidAmount,0..1
2410,ibt-181,0..1,2,The date when the paid amount is debited to the invoice.,The date when the prepaid amount was received by the seller.,Date,支払済金額が請求書に差引記載される日,前払金額を売り手が受領した日。,3000,cbc:ReceivedDate,udt:DateType,/Invoice/cac:PrepaidPayment/cbc:ReceivedDate,0..1
2420,ibt-182,0..1,2,Payment type,The type of the the payment.,Code,支払タイプ,支払いのタイプ。,3010,cbc:InstructionID,udt:IdentifierType,/Invoice/cac:PrepaidPayment/cbc:InstructionID,0..1
2430,ibg-20,0..n,1,DOCUMENT LEVEL ALLOWANCES,A group of business terms providing information about allowances applicable to the Invoice as a whole.,,請求書レベルの返金,請求書レベルの返金に関する情報を提供するビジネス用語のグループ。,3020,cac:AllowanceCharge,cac:AllowanceChargeType,/Invoice/cac:AllowanceCharge[cbc:ChargeIndicator=false()],0..n
2435,ibt-092a,1..1,2,Syntax qualifier for the document level allowance,,Indicator,,,3030,cbc:ChargeIndicator,xsd:boolean,/Invoice/cac:AllowanceCharge[cbc:ChargeIndicator=false()]/cbc:ChargeIndicator,1..1
2440,ibt-092,1..1,2,Document level allowance amount,"The amount of an allowance	 without TAX.",Amount,請求書レベルの返金金額(税抜き),返金金額(税抜き)。,3070,cbc:Amount,udt:AmountType,/Invoice/cac:AllowanceCharge[cbc:ChargeIndicator=false()]/cbc:Amount,1..1
2450,ibt-093,0..1,2,Document level allowance base amount,"The base amount that may be used	 in conjunction with the document level allowance percentage	 to calculate the document level allowance amount.",Amount,請求書レベルの返金金額の基準となる金額,請求書レベルの返金の率を乗じて請求書レベルの返金金額を算出する際に使用される基準金額。,3090,cbc:BaseAmount,udt:AmountType,/Invoice/cac:AllowanceCharge[cbc:ChargeIndicator=false()]/cbc:BaseAmount,0..1
2460,ibt-094,0..1,2,Document level allowance percentage,"The percentage that may be used	 in conjunction with the document level allowance base amount	 to calculate the document level allowance amount.",Percentage,請求書レベルの返金の率,請求書レベルの返金基準金額に乗じて、請求書レベルの返金金額を算出する際に使用されるパーセント。,3060,cbc:MultiplierFactorNumeric,udt:NumericType,/Invoice/cac:AllowanceCharge[cbc:ChargeIndicator=false()]/cbc:MultiplierFactorNumeric,0..1
2470,ibt-097,0..1,2,Document level allowance reason,"The reason for the document level allowance	 expressed as text.",Text,請求書レベルの返金の理由,請求書レベルの返金の理由をテキストで表現。,3050,cbc:AllowanceChargeReason,udt:TextType,/Invoice/cac:AllowanceCharge[cbc:ChargeIndicator=false()]/cbc:AllowanceChargeReason,0..n
2480,ibt-098,0..1,2,Document level allowance reason code,"The reason for the document level allowance	 expressed as a code.",Code,請求書レベルの返金の理由コード,請求書レベルの返金の理由コード。,3040,cbc:AllowanceChargeReasonCode,udt:CodeType,/Invoice/cac:AllowanceCharge[cbc:ChargeIndicator=false()]/cbc:AllowanceChargeReasonCode,0..1
